<?xml version="1.0" encoding="us-ascii"?>
<!-- Copyright (c) 2009 Mercury Federal Systems.

This file is part of OpenCPI.

OpenCPI is free software: you can redistribute it and/or modify
it under the terms of the GNU Lesser General Public License as published by
the Free Software Foundation, either version 3 of the License, or
(at your option) any later version.

OpenCPI is distributed in the hope that it will be useful,
but WITHOUT ANY WARRANTY; without even the implied warranty of
MERCHANTABILITY or FITNESS FOR A PARTICULAR PURPOSE.  See the
GNU Lesser General Public License for more details.

You should have received a copy of the GNU Lesser General Public License
along with OpenCPI.  If not, see <http://www.gnu.org/licenses/>.
-->

<!DOCTYPE properties SYSTEM "properties.dtd">
<!--
    Generated by Zeligsoft Component Enabler 2.4.7
    http://www.zeligsoft.com
-->
<properties>
    <description />
    <simple id="DCE:3895f3d9-1c07-4ca8-afcf-1e786e6e358f" type="string" name="portName" mode="readwrite">
        <description>max_string_size=255</description>
        <kind kindtype="configure" />
    </simple>
    <simple id="DCE:0c2709f8-2b3f-463f-bfe4-f7c25fa7031a" type="string" name="fileName" mode="readwrite">
        <description>max_string_size=255</description>
        <kind kindtype="configure" />
    </simple>
    <simple id="DCE:82f4c491-8a72-4ba6-9e3d-8265923a76ba" type="ulong" name="bytesPerPacket" mode="readwrite">
        <kind kindtype="configure" />
    </simple>
    <simple id="DCE:60d83bb4-6e60-4a70-8c22-34bc280b5f5b" type="ulong" name="offset" mode="readwrite">
        <kind kindtype="configure" />
    </simple>
    <simple id="DCE:08bf13a6-1b90-43aa-9178-986b355bdb4d" type="ulong" name="errnoValue" mode="readwrite">
        <kind kindtype="configure" />
    </simple>
    <simple id="DCE:3275d91d-492b-499c-bebb-0ae3b4e8c506" type="boolean" name="atEof" mode="readwrite">
        <kind kindtype="configure" />
    </simple>
    <simple id="DCE:7e77884c-d9b1-4260-a689-43c63c17d3da" type="boolean" name="verbose" mode="readwrite">
        <kind kindtype="configure" />
    </simple>
</properties>

<!-- Model validation produced warning or error messages.
     Use this generated XML for model debugging only. --> 
