<?xml version="1.0" encoding="us-ascii"?>
<!-- Copyright (c) 2009 Mercury Federal Systems.

This file is part of OpenCPI.

OpenCPI is free software: you can redistribute it and/or modify
it under the terms of the GNU Lesser General Public License as published by
the Free Software Foundation, either version 3 of the License, or
(at your option) any later version.

OpenCPI is distributed in the hope that it will be useful,
but WITHOUT ANY WARRANTY; without even the implied warranty of
MERCHANTABILITY or FITNESS FOR A PARTICULAR PURPOSE.  See the
GNU Lesser General Public License for more details.

You should have received a copy of the GNU Lesser General Public License
along with OpenCPI.  If not, see <http://www.gnu.org/licenses/>.
-->

<!DOCTYPE properties SYSTEM "properties.dtd">
<!--
    Generated by Zeligsoft Component Enabler 2.4.6
    http://www.zeligsoft.com
-->
<properties>
    <description />
    <simple id="DCE:50bd03ab-33b4-485f-9af4-650c2bd4e2a2" type="string" name="Source.fileName" mode="readwrite">
        <kind kindtype="configure" />
    </simple>
    <simple id="DCE:d866ff26-13c6-4ce4-88f2-32eda10cb515" type="string" name="Tee.fileName" mode="readwrite">
        <kind kindtype="configure" />
    </simple>
    <simple id="DCE:e137c8da-6ddb-481e-a56e-448332334df9" type="string" name="Sink.fileName" mode="readwrite">
        <kind kindtype="configure" />
    </simple>
</properties>
