<?xml version="1.0" encoding="us-ascii"?>
<!-- Copyright (c) 2009 Mercury Federal Systems.

This file is part of OpenCPI.

OpenCPI is free software: you can redistribute it and/or modify
it under the terms of the GNU Lesser General Public License as published by
the Free Software Foundation, either version 3 of the License, or
(at your option) any later version.

OpenCPI is distributed in the hope that it will be useful,
but WITHOUT ANY WARRANTY; without even the implied warranty of
MERCHANTABILITY or FITNESS FOR A PARTICULAR PURPOSE.  See the
GNU Lesser General Public License for more details.

You should have received a copy of the GNU Lesser General Public License
along with OpenCPI.  If not, see <http://www.gnu.org/licenses/>.
-->

<!DOCTYPE properties SYSTEM "properties.dtd">
<!--
    Generated by Zeligsoft Component Enabler 2.4.6
    http://www.zeligsoft.com
-->
<properties>
    <description />
    <simple id="DCE:be8cbe84-70ca-4117-970f-3b2cc24450c2" type="string" name="fileName" mode="readwrite">
        <description>max_string_size=256</description>
        <kind kindtype="configure" />
    </simple>
    <simple id="DCE:52d9ebfa-4102-4df6-a8b8-158d9811c528" type="ulong" name="bytesPerPacket" mode="readwrite">
        <kind kindtype="configure" />
    </simple>
    <simple id="DCE:9a429aa8-071f-4d55-ac40-c087bb51b16a" type="ulong" name="offset" mode="readonly">
        <kind kindtype="configure" />
    </simple>
    <test id="1245111881">
        <description />
        <resultvalue>
            <simple id="DCE:d5462d5b-b84a-4e12-a6a6-449ecec67b77" type="ulong" name="errnoValue" mode="readwrite">
                <kind kindtype="test" />
            </simple>
        </resultvalue>
    </test>
</properties>
