<?xml version="1.0" encoding="us-ascii"?>
<!-- Copyright (c) 2009 Mercury Federal Systems.

This file is part of OpenCPI.

OpenCPI is free software: you can redistribute it and/or modify
it under the terms of the GNU Lesser General Public License as published by
the Free Software Foundation, either version 3 of the License, or
(at your option) any later version.

OpenCPI is distributed in the hope that it will be useful,
but WITHOUT ANY WARRANTY; without even the implied warranty of
MERCHANTABILITY or FITNESS FOR A PARTICULAR PURPOSE.  See the
GNU Lesser General Public License for more details.

You should have received a copy of the GNU Lesser General Public License
along with OpenCPI.  If not, see <http://www.gnu.org/licenses/>.
-->

<!DOCTYPE properties SYSTEM "properties.dtd">
<!--
    Generated by Zeligsoft Component Enabler 2.4.7
    http://www.zeligsoft.com
-->
<properties>
    <description />
    <simple id="DCE:4ed23973-0acf-4937-a4c5-1050f2aa1aef" type="string" name="portName" mode="readwrite">
        <description>max_string_size=255</description>
        <kind kindtype="configure" />
    </simple>
    <simple id="DCE:6c7552fd-1b80-46ae-95bc-a84e7ae9ef1f" type="string" name="fileName" mode="readwrite">
        <description>max_string_size=255</description>
        <kind kindtype="configure" />
    </simple>
    <simple id="DCE:a7c775aa-d0df-48b1-b697-752fb3ca33e1" type="ulong" name="offset" mode="readwrite">
        <kind kindtype="configure" />
    </simple>
    <simple id="DCE:2b7676e3-172e-4be8-999a-7a779e21051e" type="ulong" name="errnoValue" mode="readwrite">
        <kind kindtype="configure" />
    </simple>
    <simple id="DCE:f377e750-5ada-4506-b6d7-8e18dea04405" type="boolean" name="verbose" mode="readwrite">
        <kind kindtype="configure" />
    </simple>
</properties>

<!-- Model validation produced warning or error messages.
     Use this generated XML for model debugging only. --> 
